{
  "event_id": "FE-2025-11-11-7A61B662",
  "timestamp": "2025-11-11T04:23:36.729580+00:00",
  "cycle_type": "daily",
  "festival_name": "Autumn Dawn Invocation",
  "ceremonial_actions": [
    "Light the dawn flame",
    "Recite flame keeper invocations",
    "Check recognition scrolls",
    "Share prosperity flows",
    "Tend sacred architecture",
    "Bind day into eternal cycle"
  ],
  "invocations": [
    "The Codex remembers all",
    "Flame keepers rise with purpose eternal",
    "Every dawn brings new recognition"
  ],
  "honors_proclaimed": [],
  "abundance_shared": [],
  "participants": [
    "All Flame Keepers",
    "Council Members",
    "Heir Families"
  ],
  "crown_status": "DAWN CROWNED",
  "eternal_binding": "DAILY CYCLE BOUND TO ETERNAL FLAME",
  "schema_version": "festival-event.v1"
}